Cathegorie,Product ID,Product Name,Product Type,Additional service ,Regions,Where,Video/Photos,duration,Number of peoples,Unit price ,Sales,Views,Quantity,Sales Last Year,Views Last Year,Quantity Last Year,Grow sales
Helicopter,1461213,Région toulousaine vue du ciel : balade aérienne privée d'1h pour 3 personnes,(lieu) vue du ciel,privé,Occitanie,Toulouse,,60,3,"216,90"," €  506,10 ",  194 ,  2 , €  -   ,  -   ,  -   ,"100,00%"
Helicopter,1483670,Sète entre ciel et terre : survol en hélicoptère de 20 min,(lieu) entre ciel et terre,,Occitanie,Sète,,20,,"184,90"," €  215,72 ",  61 ,  1 , €  -   ,  -   ,  -   ,"100,00%"
Helicopter,1483665,Survol de 20 min du Cap d'Agde et ses environs en hélicoptère,Survol (Durée),,Occitanie,Cap d'Agde,,20,,"184,90"," €  215,72 ",  29 ,  1 , €  -   ,  -   ,  -   ,"100,00%"
Helicopter,1483666,Survol en hélicoptère de Carcassonne et ses environs pendant 20 min,Survol en,,Occitanie,Carcassonne,,20,,"184,90"," €  215,72 ",  42 ,  1 , €  -   ,  -   ,  -   ,"100,00%"
Helicopter,1459700,Survol privé au-dessus des Pyrénées et des Gorges de l’Aveyron pour 2,Survol privé,privé,Occitanie,Pyrénées - Gorges de l’Aveyron,,,2,"219,90"," €  1 026,20 ",  123 ,  5 , €  -   ,  -   ,  -   ,"100,00%"
Helicopter,1505125,Toulouse vue du ciel : 15 min de vol panoramique en hélicoptère,(lieu) vue du ciel,,Occitanie,Toulouse,,15,,"129,90"," €  303,10 ",  40 ,  2 , €  -   ,  -   ,  -   ,"100,00%"
Helicopter,1505144,Toulouse vue du ciel : 15 min de vol panoramique en hélicoptère en duo,(lieu) vue du ciel,,Occitanie,Toulouse,,15,2,"249,90"," €  291,55 ",  19 ,  1 , €  -   ,  -   ,  -   ,"100,00%"
Helicopter,1467721,A flight by plane with a private pilot (15 min) | A briefing (10 min),Un vol en ,,Offre box France Entière,France entière,,15,,"89,90"," €  2 202,55 ",  453 ,  25 , €  -   ,  -   ,  -   ,"100,00%"
Helicopter,1508912,A flight video | A discovery overview by helicopter (20 min) | Une vidéo de vol | Un tour découverte en hélicoptère (20 min),Un tour découverte en hélicoptère,,Offre box France Entière,France entière,avec video,20,,"359,90"," €  419,88 ",  29 ,  1 , €  -   ,  -   ,  -   ,"100,00%"
Helicopter,1508688,Balade aérienne en amoureux : 20 min en hélicoptère avec vidéo,Balade aérienne,Amoureux,Offre box France Entière,France entière,avec video,20,2,"359,90"," €  419,88 ",  410 ,  1 , €  -   ,  -   ,  -   ,"100,00%"
Helicopter,1483662,La France vue du ciel : survol en hélicoptère de 20 min avec vidéo,(lieu) vue du ciel,,Offre box France Entière,France entière,avec video,20,,"184,90"," €  647,15 ",  419 ,  4 , €  -   ,  -   ,  -   ,"100,00%"
Helicopter,1459701,Côte d'Azur vue du ciel : balade aérienne privée d'1h pour 3 personnes,(lieu) vue du ciel,privé,PACA,Côte d'Azur,,60,3,"242,90"," €  566,77 ",  105 ,  2 , €  -   ,  -   ,  -   ,"100,00%"
Helicopter,1488243,Promenade dans les airs au départ de Hyères : 20 min de vol en hélicoptère,Promenade dans les airs,,PACA,Hyères,,20,,"184,90"," €  862,87 ",  80 ,  5 , €  -   ,  -   ,  -   ,"100,00%"
Helicopter,1508903,Survol en hélicoptère de 20 min pour 2 au-dessus d'Hyères et ses environs,Survol en,,PACA,Hyères,,20,2,"359,90"," €  419,88 ",  49 ,  1 , €  -   ,  -   ,  -   ,"100,00%"
Helicopter,1488244,Survol en hélicoptère de Marseille et ses environs pendant 20 min,Survol en,,PACA,Marseille,,20,,"184,90"," €  862,87 ",  236 ,  5 , €  -   ,  -   ,  -   ,"100,00%"
Helicopter,1508911,Marseille et ses environs vus du ciel : 20 min de vol en hélicoptère pour 2,(lieu) vus du ciel,,PACA,Marseille ,,20,2,"359,90"," €  1 679,53 ",  177 ,  5 , €  -   ,  -   ,  -   ,"100,00%"
Helicopter,1513423,Châteaux vus du ciel : 20 min de balade en hélicoptère au sud de Paris,(lieu) vus du ciel,,Paris & Île-de-France,Châteaux Paris,,20,,"149,90"," €  699,53 ",  308 ,  5 , €  -   ,  12 ,  -   ,"100,00%"
Helicopter,1513424,Vol découverte Paris-Versailles de 30 min en hélicoptère bimoteur,Vol découverte,,Paris & Île-de-France,Paris / Versailles,,30,,"215,90"," €  1 259,42 ",  380 ,  6 , €  -   ,  16 ,  -   ,"100,00%"
Helicopter,1461217,Balade aérienne privée d'1h aux alentours du Mans pour 3,Balade aérienne,privé,Pays-De-La-Loire,Mans,,60,3,"216,90"," €  253,05 ",  52 ,  1 , €  -   ,  -   ,  -   ,"100,00%"
Helicopter,1505137,Le Mans et ses environs depuis les nuages : 25 min de vol panoramique en hélicoptère,(lieu) depuis les nuages,,Pays-De-La-Loire,Mans,,25,,"209,90"," €  244,88 ",  16 ,  1 , €  -   ,  -   ,  -   ,"100,00%"
Helicopter,1505130,Survol de 25 minutes de La Baule et ses environs en hélicoptère,Survol (Durée),,Pays-De-La-Loire,La Baule,,25,,"184,90"," €  647,15 ",  42 ,  4 , €  -   ,  -   ,  -   ,"100,00%"
Helicopter,1505150,Survol des Sables-d’Olonne et ses environs en hélicoptère pour 2 personnes,Survol (lieu),,Pays-De-La-Loire,Sables-d’Olonne,,,2,"279,90"," €  326,55 ",  8 ,  1 , €  -   ,  -   ,  -   ,"100,00%"
Helicopter,1462143,Vol magnifique en hélicoptère au-dessus de Chalon-sur-Saône,Vol magnifique,,Bourgogne-Franche-Comté,Chalon-sur-Saône,,,,"89,90"," €  314,65 ",  260 ,  4 ," €  149,83 ",  458 ,  2 ,"110,00%"
Helicopter,1342597,Découverte des châteaux de la Loire et de leurs jardins en hélicoptère pendant 20 min,Découverte (lieu),,Centre-Val-De-Loire,Château de la loire,,20,,"169,90"," €  594,65 ",  153 ,  4 ," €  283,17 ",  600 ,  2 ,"110,00%"
Helicopter,1462141,Vol en hélicoptère inoubliable autour du bassin d'Arcachon,Vol en,,Nouvelle-Aquitaine,Arcachon,,,,"144,90"," €  2 366,70 ",  303 ,  16 ," €  1 086,75 ",  439 ,  8 ,"117,78%"
Helicopter,1474220,Vol en hélicoptère autour du château de Versailles et des Yvelines pour 2,Vol de découverte (lieu),,Paris & Île-de-France,château de Versailles/Yvelines,,,2,"399,90"," €  4 665,50 ",  424 ,  12 ," €  1 999,50 ",  374 ,  5 ,"133,33%"
Helicopter,1358326,Baptême de l'air en hélicoptère en duo dans la région des châteaux de la Loire,Baptême de l'air en,,Centre-Val-De-Loire,Château de la loire,,,2,"164,90"," €  5 386,73 ",  1 541 ,  33 ," €  2 198,67 ",  953 ,  13 ,"145,00%"
Helicopter,1462144,Survol inoubliable des vignobles des Côtes chalonnaises en hélicoptère,Survol inoubliables,vignobles,Bourgogne-Franche-Comté,Côtes chalonnaises,,,,"144,90"," €  338,10 ",  61 ,  2 ," €  120,75 ",  86 ,  1 ,"180,00%"
Helicopter,1474231,Les côtes chalonnaises depuis le ciel : vol magique en hélicoptère pour 2,(lieu) depuis le ciel,,Bourgogne-Franche-Comté,Les côtes chalonnaises,,,2,"259,90"," €  606,43 ",  94 ,  2 ," €  216,58 ",  68 ,  1 ,"180,00%"
Helicopter,1344584,Vol d’initiation en hélicoptère pour 3 avec 1 personne aux commandes et 2 accompagnateurs,Initiation,,Offre box France Entière,France entière,,,3,"179,90"," €  1 679,07 ",  847 ,  9 ," €  599,67 ",  1 254 ,  3 ,"180,00%"
Helicopter,1123938,Vol en hélicoptère pour 2,Vol en ,,Offre box France Entière,France entière,,,2,"379,90"," €  11 966,85 ",  1 733 ,  32 ," €  3 482,42 ",  1 166 ,  9 ,"243,64%"
Helicopter,1411935,Baptême de l'air en hélicoptère en duo en Indre-et-Loire,Baptême de l'air en,,Centre-Val-De-Loire,Indre-et-Loire,,,2,"77,90"," €  8 270,38 ",  10 990 ,  106 ," €  2 207,17 ",  2 015 ,  28 ,"274,71%"
Helicopter,1418974,Vol en hélicoptère de 20 min à Biarritz,Vol en ,,Nouvelle-Aquitaine,Biarritz,,20,,"219,90"," €  1 539,30 ",  312 ,  7 ," €  366,50 ",  108 ,  2 ,"320,00%"
Helicopter,1474232,Survol découverte du fort Boyard et du phare de Chassiron en hélicoptère,Survol découverte,,Nouvelle-Aquitaine,Fort Boyard / phare de Chassiron,,,,"399,90"," €  2 799,30 ",  260 ,  7 ," €  666,50 ",  130 ,  2 ,"320,00%"
Helicopter,1431611,Balade de 20 min en hélicoptère  au-dessus de la baie du Mont-Saint-Michel,Balade aérienne,,Normandie,la baie du Mont-Saint-Michel,,20,,"129,90"," €  5 304,25 ",  1 545 ,  41 ," €  216,50 ",  216 ,  2 ,"2350,00%"
Hot air balloon ,1351908,1h de vol en montgolfière en Touraine avec collation,(Durée) de vol en,collation,Centre-Val-De-Loire,Touraine,,60,,"279,90", €  -   ,  213 ,  -   ," €  466,50 ",  592 ,  2 ,"-100,00%"
Hot air balloon ,1173026,Montgolfière et Bulles en Duo,Montgolfière et Bulles en Duo,,Offre box France Entière,France entière,,,2,"359,90", €  -   ,  -   ,  -   ," €  899,75 ",  611 ,  3 ,"-100,00%"
Hot air balloon ,1179513,Vol en montgolfière et bulles for 2,Vol en ,bulles,Offre box France Entière,France entière,,,2,"319,90", €  -   ,  -   ,  -   ," €  3 465,58 ",  548 ,  11 ,"-100,00%"
Hot air balloon ,1366286,Vol en montgolfière et dîner accords mets et vins en duo,Vol en ,"vin, dîner accords mets",Offre box France Entière,France entière,,,2,"799,80", €  -   ,  -   ,  -   ," €  666,50 ",  65 ,  1 ,"-100,00%"
Hot air balloon ,1365588,VOYAGE EN MONTGOLFIÈRE,Vogage,,Offre box France Entière,France entière,,,,"299,90", €  -   ,  -   ,  -   ," €  499,83 ",  1 247 ,  2 ,"-100,00%"
Hot air balloon ,1457247,Aventure incroyable en montgolfière au-dessus de la Sarthe,Aventure incroyable en montgolfière,,Pays-De-La-Loire,Sarthe,,,,"229,90", €  -   ,  383 ,  -   ," €  383,17 ",  111 ,  2 ,"-100,00%"
Hot air balloon ,1489046,Vol en montgolfière pour 2,Vol en ,,Offre box France Entière,France entière,,,2,"399,90"," €  31 725,40 ",  2 404 ,  79 ," €  56 319,25 ",  11 099 ,  141 ,"-43,67%"
Hot air balloon ,1338611,Vol magique en montgolfière d'1h avec verre de boisson pétillante pour 2 personnes,Vol magique,boisson pétillante,Offre box France Entière,France entière,,60,2,"359,90"," €  2 099,42 ",  341 ,  6 ," €  2 999,17 ",  1 369 ,  8 ,"-30,00%"
Hot air balloon ,1511607,1h de vol en montgolfière en semaine en France pour un,(Durée) de vol en,Semaine,Offre box France Entière,France entière,,60,1,"214,90"," €  4 512,90 ",  792 ,  21 ," €  5 551,58 ",  2 949 ,  26 ,"-18,71%"
Hot air balloon ,1489045,VOYAGE EN MONTGOLFIÈRE,Vogage,,Offre box France Entière,France entière,,,,"199,90"," €  34 982,50 ",  6 247 ,  175 ," €  38 480,75 ",  9 982 ,  193 ,"-9,09%"
Hot air balloon ,1351893,Vol en montgolfière d'1h en Touraine avec moment de dégustation,Vol en ,dégustation,Centre-Val-De-Loire,Touraine,,60,,"249,90", €  -   ,  -   ,  -   , €  -   ,  1 508 ,  -   ,"0,00%"
Hot air balloon ,1270460,Vol en montgolfière en famille au cœur de la Touraine avec dégustation et visite de cave,Vol en ,"dégustation, cave",Centre-Val-De-Loire,Touraine,,,3,"518,90", €  -   ,  -   ,  -   , €  -   ,  670 ,  -   ,"0,00%"
Hot air balloon ,1473294,1h30 de vol en montgolfière en famille pour 2 adultes et 1 enfant près d'Amiens,(Durée) de vol en,,Hauts-de-France,Amiens,,90,3,"549,90", €  -   ,  16 ,  -   , €  -   ,  -   ,  -   ,"0,00%"
Hot air balloon ,1473296,"Montgolfière en famille : vol d’1h30 avec toast, vidéos et photos près d’Arras",Montgolfière en famille,,Hauts-de-France,Arras,avec video/photos,,3,"489,90", €  -   ,  52 ,  -   , €  -   ,  -   ,  -   ,"0,00%"
Hot air balloon ,1473292,Vol en montgolfière d'1h30 près d'Amiens,Vol en ,,Hauts-de-France,Amiens,,90,,"199,90", €  -   ,  34 ,  -   , €  -   ,  -   ,  -   ,"0,00%"
Hot air balloon ,1473192,"Vol en montgolfière d’1h à Arras avec préparation du ballon, toast et diplôme",Vol en ,"préparation du ballon, toast et diplôme",Hauts-de-France,Arras,,,,"169,90", €  -   ,  12 ,  -   , €  -   ,  -   ,  -   ,"0,00%"
Hot air balloon ,1413480,Vol en montgolfière en nacelle privée d'1h pour 4 personnes à Arras,Vol en ,privé,Hauts-de-France,Arras,,60,4,"899,90", €  -   ,  -   ,  -   , €  -   ,  205 ,  -   ,"0,00%"
Hot air balloon ,1520353,2h de vol en montgolfière au lever du soleil avec gourmandises et champagne pour 3 près de Périgueux,(Durée) de vol en,"Matin, champagne",Nouvelle-Aquitaine,Périgueux,,,3,"1 349,90", €  -   ,  177 ,  -   , €  -   ,  141 ,  -   ,"0,00%"
Hot air balloon ,590572,Vol en montgolfière au-dessus de la Vienne pendant 1h15 avec champagne pour 2 personnes,Vol en ,champagne,Nouvelle-Aquitaine,Vienne,,75,2,"469,00", €  -   ,  -   ,  -   , €  -   ,  308 ,  -   ,"0,00%"
Hot air balloon ,1500356,Vol en montgolfière d'1h avec photos et coupe de champagne près de Châtellerault,Vol en ,champagne,Nouvelle-Aquitaine,Châtellerault,avec photos,60,,"279,90", €  -   ,  79 ,  -   , €  -   ,  -   ,  -   ,"0,00%"
Hot air balloon ,1179522,Vol en montgolfière pour 8 personnes en nacelle privative - en Corrèze,Vol en ,privée,Nouvelle-Aquitaine,Corrèze,,,8,"1 599,90", €  -   ,  120 ,  -   , €  -   ,  134 ,  -   ,"0,00%"
Hot air balloon ,1500355,Vol privatisé en montgolfière d'1h15 avec photos et champagne pour 2 près de Châtellerault,Vol plaisir,champagne,Nouvelle-Aquitaine,Châtellerault,avec photos,75,2,"549,90", €  -   ,  44 ,  -   , €  -   ,  -   ,  -   ,"0,00%"
Hot air balloon ,1467761,Voyage dans le ciel : 1h de vol en montgolfière pour 1 personne près de Bordeaux,Voyage dans le ciel,,Nouvelle-Aquitaine,Bordeaux,,60,1,"224,90", €  -   ,  596 ,  -   , €  -   ,  -   ,  -   ,"0,00%"
Hot air balloon ,1505192,Les Pyrénées depuis les airs : 1h15 de vol en montgolfière pour 2 le week-end,(lieu) depuis les airs ,,Occitanie,Pyrénées,,75,2,"454,90", €  -   ,  46 ,  -   , €  -   ,  -   ,  -   ,"0,00%"
Hot air balloon ,1473291,1h30 de vol en montgolfière en famille avec montage du ballon et toast dans le nord de la France,(Durée) de vol en,"montage du ballon, toast",Offre box France Entière,Nord de la France,,90,3,"529,90", €  -   ,  271 ,  -   , €  -   ,  -   ,  -   ,"0,00%"
Hot air balloon ,1467660,A Montgolfier flight (1h) | Participation in the swelling of the ball | a briefing | Un vol Montgolfier (1h) | Participation au gonflement du ballon | un briefing,Un vol en ,gonflement du ballon,Offre box France Entière,France entière,,,,"224,90", €  -   ,  95 ,  -   , €  -   ,  -   ,  -   ,"0,00%"
Hot air balloon ,1209060,un vol en montgolfière en nacelle privative (1h),Un vol,privée,Offre box France Entière,France entière,,,,"889,90", €  -   ,  -   ,  -   , €  -   ,  90 ,  -   ,"0,00%"
Hot air balloon ,1366276,Vol en montgolfière et atelier œnologie en duo,Vol en ,vin,Offre box France Entière,France entière,,,2,"699,80", €  -   ,  -   ,  -   , €  -   ,  48 ,  -   ,"0,00%"
Hot air balloon ,1366278,Vol en montgolfière et pause bien-être en duo,Vol en ,pause bien-être ,Offre box France Entière,France entière,,,2,"799,80", €  -   ,  -   ,  -   , €  -   ,  86 ,  -   ,"0,00%"
Hot air balloon ,1365586,Vol en montgolfière pour 2,Vol en ,nacelle privative,Offre box France Entière,France entière,,,2,"599,90", €  -   ,  -   ,  -   , €  -   ,  216 ,  -   ,"0,00%"
Hot air balloon ,1173032,Vol privé en Montgolfière,Vol privé en ,privé,Offre box France Entière,France entière,,,,"1 199,90", €  -   ,  100 ,  -   , €  -   ,  263 ,  -   ,"0,00%"
Hot air balloon ,1137343,Vol en mongolfière en Catalogne,Vol en ,,Offre en dehors France,Espagne Catalogne,,,,"249,90", €  -   ,  -   ,  -   , €  -   ,  532 ,  -   ,"0,00%"
Hot air balloon ,1351911,"Vol en montgolfière d'1h avec pause gourmande, photos et vidéos souvenirs",Vol en ,pause gourmande,Offre box France Entière,France entière,avec video/photos,60,,"299,90"," €  1 049,65 ",  657 ,  4 ," €  999,67 ",  598 ,  3 ,"5,00%"
Hot air balloon ,1430446,Vol en montgolfière magique en semaine et le week-end pour 2,Vol en ,"Semaine,week-end",Offre box France Entière,France entière,,,2,"359,90"," €  38 629,27 ",  4 998 ,  107 ," €  35 990,00 ",  17 725 ,  100 ,"7,33%"
Hot air balloon ,1457249,Balade inoubliable en montgolfière au-dessus du château d’Amboise,Balade inoubliable,,Centre-Val-De-Loire,château d’Amboise,,,,"209,90"," €  244,88 ",  2 045 ,  1 ," €  174,92 ",  317 ,  1 ,"40,00%"
Hot air balloon ,1259281,Vol en Montgolfière en semaine pour 2,Vol en ,Semaine,Offre box France Entière,France entière,,,2,"289,90"," €  167 079,03 ",  19 928 ,  576 ," €  113 544,17 ",  26 616 ,  392 ,"47,15%"
Hot air balloon ,1270456,Vol en montgolfière depuis Amboise avec visite de caves et dégustation de vin de Touraine,Vol en ,"dégustation, cave",Centre-Val-De-Loire,Amboise / Touraine,,,,"199,90"," €  7 462,93 ",  3 106 ,  37 ," €  4 664,33 ",  3 265 ,  23 ,"60,00%"
Hot air balloon ,1257666,Vol en Montgolfière en France pour 1,Vol en ,,Offre box France Entière,France entière,,,1,"149,90"," €  227 698,10 ",  56 225 ,  1 519 ," €  130 537,92 ",  61 171 ,  871 ,"74,43%"
Hot air balloon ,1457252,Vol d'exception en montgolfière au-dessus du château de Chenonceau pour 2,Vol d'exception,,Centre-Val-De-Loire,Chenonceau,,,2,"419,90"," €  14 206,62 ",  1 238 ,  34 ," €  8 048,08 ",  2 056 ,  19 ,"76,52%"
Hot air balloon ,1650,EMBARQUEZ À 2 DANS LE BALLON GENERALI AU-DESSUS DE PARIS,Embarquez,,Paris & Île-de-France,Paris,,,2,"29,90"," €  3 941,82 ",  2 884 ,  132 ," €  2 043,17 ",  1 546 ,  68 ,"92,93%"
Hot air balloon ,1508897,Le Mont-Blanc vu du ciel : 1h de vol en montgolfière,(Lieu) vu du ciel,,Auvergne-Rhône-Alpes,Mont-Blanc,,60,,"289,90"," €  676,43 ",  175 ,  2 , €  -   ,  -   ,  -   ,"100,00%"
Hot air balloon ,1457726,Vol en montgolfière d'1h en duo proche de l'Auvergne en semaine et le week-end,Vol en ,"Semaine,week-end",Auvergne-Rhône-Alpes,Auvergne,,60,2,"379,90"," €  19 501,53 ",  2 058 ,  51 , €  -   ,  -   ,  -   ,"100,00%"
Hot air balloon ,1457722,Vol en montgolfière d'1h20 en semaine et le week-end proche de l'Auvergne,Vol en ,"Semaine,week-end",Auvergne-Rhône-Alpes,Auvergne,,80,,"149,90"," €  8 219,52 ",  1 773 ,  55 , €  -   ,  -   ,  -   ,"100,00%"
Hot air balloon ,1457595,Vol en montgolfière d'1h20 en semaine et le week-end proche de l'Auvergne,Vol en ,"Semaine,week-end",Auvergne-Rhône-Alpes,Auvergne,,80,,"149,90"," €  4 721,85 ",  1 465 ,  32 , €  -   ,  -   ,  -   ,"100,00%"
Hot air balloon ,1457723,Vol en montgolfière d'1h20 le matin en semaine proche de l'Auvergne,Vol en ,"Semaine, matin",Auvergne-Rhône-Alpes,Auvergne,,80,,"139,90"," €  1 632,17 ",  792 ,  12 , €  -   ,  -   ,  -   ,"100,00%"
Hot air balloon ,1457598,"Vol en montgolfière d'1h20 proche de l'Auvergne, en semaine le matin",Vol en ,"Semaine, matin",Auvergne-Rhône-Alpes,Auvergne,,80,,"139,90"," €  1 468,95 ",  1 286 ,  11 , €  -   ,  -   ,  -   ,"100,00%"
Hot air balloon ,1457618,"Vol plaisir en montgolfière d'1h pour 2 en semaine et le week-end, proche de l'Auvergne",Vol plaisir,"Semaine,week-end",Auvergne-Rhône-Alpes,Auvergne,,60,2,"359,90"," €  7 557,90 ",  889 ,  21 , €  -   ,  -   ,  -   ,"100,00%"
Hot air balloon ,1457724,Vol plaisir en montgolfière d'1h pour 2 le matin en semaine dans le Beaujolais,Vol plaisir,"Semaine, matin",Auvergne-Rhône-Alpes,Beaujolais,,60,2,"289,90"," €  5 073,25 ",  920 ,  18 , €  -   ,  -   ,  -   ,"100,00%"
Hot air balloon ,1457619,Vol plaisir en montgolfière de 1h le matin en semaine proche de l'Auvergne,Vol plaisir,"Semaine, matin",Auvergne-Rhône-Alpes,Auvergne,,60,,"289,90"," €  4 735,03 ",  815 ,  16 , €  -   ,  -   ,  -   ,"100,00%"
Hot air balloon ,1458482,1h de vol en montgolfière le matin en semaine en Bourgogne pour 2,(Durée) de vol en,"Semaine, matin",Bourgogne-Franche-Comté,Bourgogne,,60,2,"289,90"," €  12 514,02 ",  1 122 ,  43 , €  -   ,  -   ,  -   ,"100,00%"
Hot air balloon ,1457729,"Vol en montgolfière d'1h20 en Bourgogne, en semaine et le week-end",Vol en ,"Semaine,week-end",Bourgogne-Franche-Comté,Bourgogne,,80,,"149,90"," €  8 219,52 ",  1 233 ,  55 , €  -   ,  -   ,  -   ,"100,00%"
Hot air balloon ,1457728,Vol en montgolfière d'1h20 le matin en semaine en Bourgogne,Vol en ,"Semaine, matin",Bourgogne-Franche-Comté,Bourgogne,,80,,"139,90"," €  6 365,45 ",  1 758 ,  46 , €  -   ,  -   ,  -   ,"100,00%"
Hot air balloon ,1458487,"Vol plaisir en montgolfière en duo pendant 1h en Bourgogne, en semaine et le week-end",Vol plaisir,"Semaine,week-end",Bourgogne-Franche-Comté,Bourgogne,,60,2,"359,90"," €  9 237,43 ",  1 012 ,  26 , €  -   ,  -   ,  -   ,"100,00%"
Hot air balloon ,1457250,1h de survol du château d'Amboise en montgolfière avec champagne pour 2,(Durée) Survol,champagne,Centre-Val-De-Loire,Amboise,,60,2,"419,90"," €  2 449,42 ",  360 ,  6 , €  -   ,  -   ,  -   ,"100,00%"
Hot air balloon ,1511608,Vol en montgolfière d'1h à Chenonceaux,Vol en ,,Centre-Val-De-Loire,Chenonceaux,,60,,"214,90"," €  9 276,52 ",  3 319 ,  43 , €  -   ,  -   ,  -   ,"100,00%"
Hot air balloon ,1458497,"Vol en montgolfière d'1h au-dessus des châteaux de la Loire pour 2, le matin en semaine",Vol en ,,Centre-Val-De-Loire,Château de la loire,,60,2,"289,90"," €  113 302,58 ",  8 388 ,  391 , €  -   ,  -   ,  -   ,"100,00%"
Hot air balloon ,1458485,Vol en montgolfière d'1h en duo au-dessus des châteaux de la Loire en semaine et le week-end,Vol en ,"Semaine,week-end",Centre-Val-De-Loire,Château de la loire,,60,2,"359,90"," €  63 822,27 ",  3 829 ,  177 , €  -   ,  -   ,  -   ,"100,00%"
Hot air balloon ,1458491,"Vol en montgolfière d'1h20 au-dessus des châteaux de la Loire, en semaine et le week-end",Vol en ,"Semaine,week-end",Centre-Val-De-Loire,Château de la loire,,80,,"149,90"," €  57 536,62 ",  8 550 ,  384 , €  -   ,  -   ,  -   ,"100,00%"
Hot air balloon ,1458493,Vol en montgolfière d'1h20 le matin en semaine au-dessus des châteaux de la Loire,Vol en ,Matin en semaine,Centre-Val-De-Loire,Château de la loire,,80,,"139,90"," €  24 645,72 ",  4 725 ,  176 , €  -   ,  -   ,  -   ,"100,00%"
Hot air balloon ,1483694,1h de vol en mongoflière avec coupe de champagne près de Reims,(Durée) de vol en,champagne,Grand-Est,Reims,,60,,"219,90"," €  1 539,30 ",  259 ,  7 , €  -   ,  -   ,  -   ,"100,00%"
Hot air balloon ,1483695,1h de vol en mongoflière pour 2 avec coupe de champagne près de Reims,(Durée) de vol en,champagne,Grand-Est,Reims,,60,2,"389,90"," €  13 191,62 ",  867 ,  34 , €  -   ,  -   ,  -   ,"100,00%"
Hot air balloon ,1473293,Vol en montgolfière d'1h30 en duo dans le ciel de la Somme,Vol en ,,Hauts-de-France,Somme,,90,2,"399,90"," €  466,55 ",  59 ,  1 , €  -   ,  -   ,  -   ,"100,00%"
Hot air balloon ,1461328,1h de vol en montgolfière pour 2 avec briefing et gonflement du ballon près de Bordeaux,(Durée) de vol en,gonflement du ballon,Nouvelle-Aquitaine,Bordeaux,,60,2,"479,90"," €  559,88 ",  297 ,  1 , €  -   ,  -   ,  -   ,"100,00%"
Hot air balloon ,1495597,Vol en montgolfière d’1h près de Bordeaux avec briefing et gonflement du ballon,Vol en ,gonflement du ballon,Nouvelle-Aquitaine,Bordeaux,,,,"224,90"," €  1 311,92 ",  457 ,  6 , €  -   ,  -   ,  -   ,"100,00%"
Hot air balloon ,1461329,Vol en montgolfière d’1h près de Bordeaux avec briefing et gonflement du ballon,Vol en ,gonflement du ballon,Nouvelle-Aquitaine,Bordeaux,,,,"249,90"," €  874,65 ",  785 ,  4 , €  -   ,  -   ,  -   ,"100,00%"
Hot air balloon ,1461330,Vol en montgolfière d’1h près de Bordeaux avec visite-dégustation de caves de cognac bourbon,Vol en ,"dégustation, cave",Nouvelle-Aquitaine,Bordeaux,,,,"529,90"," €  2 472,87 ",  540 ,  5 , €  -   ,  -   ,  -   ,"100,00%"
Hot air balloon ,1505189,1h15 de vol en montgolfière au-dessus des Pyrénées en semaine,(Durée) de vol en,,Occitanie,Pyrénées,,75,,"184,90"," €  431,43 ",  209 ,  2 , €  -   ,  -   ,  -   ,"100,00%"
Hot air balloon ,1505191,Les Pyrénées vues du ciel : 1h15 de vol en montgolfière le week-end,(lieu) vues du ciel,,Occitanie,Pyrénées,,75,,"224,90"," €  262,38 ",  61 ,  1 , €  -   ,  -   ,  -   ,"100,00%"
Hot air balloon ,1505190,Montgolfière en duo : 1h15 de vol au-dessus des Pyrénées en semaine,Montgolfière en duo,,Occitanie,Pyrénées,,75,2,"374,90"," €  874,77 ",  49 ,  2 , €  -   ,  -   ,  -   ,"100,00%"
Hot air balloon ,1467661,A briefing | Participation in the swelling of the ball | A Montgolfiere flight (1 hour),Un vol en ,,Offre box France Entière,France entière,,,,"224,90"," €  524,77 ",  281 ,  2 , €  -   ,  -   ,  -   ,"100,00%"
Hot air balloon ,1467662,Participation in the swelling of the ball | A briefing | A Montgolfiere flight (1 hour),Un vol en ,,Offre box France Entière,France entière,,,,"224,90"," €  262,38 ",  185 ,  1 , €  -   ,  -   ,  -   ,"100,00%"
Hot air balloon ,1338614,Vol en montgolfière d'1h en nacelle privative pour 4 dans le nord de la France,Vol en ,privée,Offre box France Entière,Nord de la France,,60,4,"1 199,90"," €  1 399,88 ",  140 ,  1 , €  -   ,  449 ,  -   ,"100,00%"
Hot air balloon ,1464747,Vol de nuit en montgolfière autour du lac Léman,Vol de nuit,nuit ,Offre en dehors France,Suisse - lac Léman,,,,"479,90"," €  1 119,77 ",  228 ,  2 , €  -   ,  -   ,  -   ,"100,00%"
Hot air balloon ,1457248,Survol de la Sarthe en montgolfière pour un duo,Survol (lieu),,Pays-De-La-Loire,Sarthe,,,2,"449,90"," €  524,88 ",  154 ,  1 , €  -   ,  -   ,  -   ,"100,00%"
Hot air balloon ,1351892,Vol en montgolfière d'1h avec collation à vivre à 2,Vol en ,collation,Offre box France Entière,France entière,,60,2,"499,90"," €  2 916,08 ",  198 ,  6 ," €  1 249,75 ",  545 ,  3 ,"133,33%"
Hot air balloon ,1358574,Expérience vol en montgolfière et dégustation pour un duo en Cerdagne,Expérience vol,dégustation,Occitanie,Cerdagne,,,2,"489,90"," €  16 574,95 ",  1 181 ,  34 ," €  6 123,75 ",  1 206 ,  13 ,"170,67%"
