Cathegorie,Product ID,Product Name,Product Type,Additional service ,Regions,Where,Video/Photos,duration,Number of peoples,Unit price ,Sales,Views,Quantity,Sales Last Year,Views Last Year,Quantity Last Year,Grow sales
ULM/Plane,1265193,Excursion au dessus des Châteaux de la Loire en avion privé,Excursion,privé,Centre-Val-De-Loire,Château de la loire,,,,"372,90", €  -   ,  -   ,  -   ," €  310,75 ",  150 ,  1 ,"-100,00%"
ULM/Plane,1321905,Vol dans la Vallée de la Loire au-dessus des châteaux en avion privé pour 2 (1h),Vol (lieu),privé,Centre-Val-De-Loire,Château de la loire,châteaux,60,2,"220,90", €  -   ,  -   ,  -   ," €  184,08 ",  153 ,  1 ,"-100,00%"
ULM/Plane,1403193,Balade aérienne privée à destination du mont Saint-Michel,Balade aérienne,privé,Normandie,Mont Saint-Michel,,,,"324,90", €  -   ,  -   ,  -   ," €  812,25 ",  93 ,  3 ,"-100,00%"
ULM/Plane,1321902,Survol des plages du débarquement pour 2 avec pilote privé (45 min),Survol (lieu),privé,Normandie,Plages du débarquement,,45,2,"176,90", €  -   ,  33 ,  -   ," €  8 107,92 ",  1 451 ,  46 ,"-100,00%"
ULM/Plane,1424697,Vol privé de 45 min au-dessus des Jardins d'Étretat et des plages du débarquement pour 2,Vol privé,privé,Normandie,Étretat/Plages débarquement,,45,2,"179,90", €  -   ,  19 ,  -   ," €  4 047,75 ",  721 ,  23 ,"-100,00%"
ULM/Plane,1403107,Balade d’1h30 en avion à la découverte des Pyrénées depuis Toulouse en duo,Balade (durée),depuis Toulouse,Occitanie,Pyrénées - Toulouse,,90,2,"299,90", €  -   ,  -   ,  -   ," €  499,83 ",  61 ,  2 ,"-100,00%"
ULM/Plane,1278488,Excursion en Côte d'Azur en avion privé pour 2 (1h30),Excursion,privé,PACA,Côte d'Azur,,90,2,"372,90", €  -   ,  -   ,  -   ," €  621,50 ",  158 ,  2 ,"-100,00%"
ULM/Plane,1456444,Survol privé de la Côte d’Azur d’1h pour 2,Survol privé,privé,PACA,Côte d’Azur,,60,2,"205,90", €  -   ,  235 ,  -   ," €  6 177,00 ",  1 077 ,  30 ,"-100,00%"
ULM/Plane,1321906,Survol de la côte marseillaise en avion privé pour 2 (1h),Survol (lieu),privé,PACA,Marseille,,60,2,"239,90", €  -   ,  -   ,  -   ," €  599,75 ",  138 ,  3 ,"-100,00%"
ULM/Plane,1278483,Balade aérienne privée au-dessus des châteaux de la région parisienne,Balade aérienne,privé,Paris & Île-de-France,Châteaux région parisienne,,,,"179,90", €  -   ,  5 ,  -   ," €  449,75 ",  187 ,  3 ,"-100,00%"
ULM/Plane,1278484,Balade en avion pour 2 avec pilote privé en région parisienne,Balade en ,privé,Paris & Île-de-France,région parisienne,,,2,"249,90", €  -   ,  1 ,  -   ," €  208,25 ",  133 ,  1 ,"-100,00%"
ULM/Plane,1402347,Excursion magique de Paris à Deauville en avion privé,Excursion magique,privé,Paris & Île-de-France,Paris/Deauville,,,,"529,90", €  -   ,  -   ,  -   ," €  441,58 ",  92 ,  1 ,"-100,00%"
ULM/Plane,1278489,Balade en avion privé dans les environs du Mans pour 2 personnes (1h),Balade en ,privé,Pays-De-La-Loire,Mans,,60,2,"219,90", €  -   ,  4 ,  -   ," €  183,25 ",  175 ,  1 ,"-100,00%"
ULM/Plane,1403183,Vol d’1h en duo (pour 2) pour admirer les châteaux de la Loire,(Durée) de vol,,Centre-Val-De-Loire,Château de la loire,,60,2,"139,90"," €  1 142,52 ",  378 ,  8 ," €  35 208,17 ",  15 190 ,  252 ,"-96,75%"
ULM/Plane,1279123,Baptême de l’air et vidéo au-dessus des villages typiques du Mont-Ventoux,Baptême de l’air,,PACA,Mont-Ventoux,avec video,,,"148,90"," €  173,72 ",  76 ,  1 ," €  496,33 ",  123 ,  3 ,"-65,00%"
ULM/Plane,1382010,45 minutes de vol avec pilote privé au-dessus de la Côte d’Opale,(Durée) de vol,privé,Hauts-de-France,Côte d’Opale,,45,,"179,90"," €  209,88 ",  331 ,  1 ," €  449,75 ",  128 ,  3 ,"-53,33%"
ULM/Plane,1456443,Vol privé d'1h au-dessus de la Côte d’Azur pour 2 personnes,Vol privé,privé,PACA,Côte d'Asuz,,60,2,"215,90"," €  2 015,07 ",  303 ,  9 ," €  2 338,92 ",  471 ,  11 ,"-13,85%"
ULM/Plane,1402341,Vol privé d'1h pour 2 au-dessus de Besançon et ses alentours,Vol privé,privé,Bourgogne-Franche-Comté,Besançon,,60,2,"244,90", €  -   ,  -   ,  -   , €  -   ,  34 ,  -   ,"0,00%"
ULM/Plane,1508157,Bastia vue d’en haut : baptême de l’air de 25 min avec pilotage en Stampe SV4 RS,"(lieu) vue d'en haut, Baptême de l’air",,Corse,Bastia,,25,,"199,90", €  -   ,  29 ,  -   , €  -   ,  -   ,  -   ,"0,00%"
ULM/Plane,1508159,Baptême de l’air de 25 min avec pilotage en Stampe SV4 RS près de Reims,Baptême de l’air,,Grand-Est,Reims,,25,,"199,90", €  -   ,  7 ,  -   , €  -   ,  -   ,  -   ,"0,00%"
ULM/Plane,1397528,Vol découverte de nuit en avion pendant 25 minutes près de Valenciennes,Vol découverte de nuit,nuit ,Hauts-de-France,Valenciennes,,25,,"199,90", €  -   ,  27 ,  -   , €  -   ,  62 ,  -   ,"0,00%"
ULM/Plane,1278487,Vol d'1h en avion privé au dessus de la Côte d'Azur,Vol de (durée),privé,PACA,Côte d'Azur,,60,,"279,90", €  -   ,  -   ,  -   , €  -   ,  89 ,  -   ,"0,00%"
ULM/Plane,1508158,Saint-Cyr vue d’en haut : baptême de l’air de 25 min avec pilotage en Stampe SV4 RS,"(lieu) vue d'en haut, Baptême de l’air",,PACA,Saint-Cyr,,25,,"199,90", €  -   ,  5 ,  -   , €  -   ,  -   ,  -   ,"0,00%"
ULM/Plane,1461181,1h de survol des châteaux de la région parisienne en famille,(Durée) Survol,,Paris & Île-de-France,Châteaux région parisienne,,60,3,"224,90", €  -   ,  89 ,  -   , €  -   ,  -   ,  -   ,"0,00%"
ULM/Plane,1424699,Balade aérienne privée d’1h avec service Premium aux alentours du Mans,Balade aérienne,"privé, Service Premium",Pays-De-La-Loire,Mans,,,,"219,90", €  -   ,  4 ,  -   , €  -   ,  33 ,  -   ,"0,00%"
ULM/Plane,1456447,Balade aérienne privée d'1h pour 2 au-dessus du bassin d'Arcachon,Balade aérienne,privé,Nouvelle-Aquitaine,Arcachon,,60,2,"179,90"," €  4 617,43 ",  582 ,  26 ," €  3 598,00 ",  606 ,  20 ,"28,33%"
ULM/Plane,1382008,Vol avec pilote privé au-dessus de la Côte d’Opale,Vol avec pilote privé,privé,Hauts-de-France,Côte d’Opale,,,,"79,90"," €  559,30 ",  280 ,  7 ," €  332,92 ",  216 ,  4 ,"68,00%"
ULM/Plane,1461179,1h de vol privé en avion au-dessus de Lyon et ses alentours pour 3 personnes,(Durée) de vol,privé,Auvergne-Rhône-Alpes,Lyon,,60,3,"254,90"," €  297,38 ",  56 ,  1 , €  -   ,  -   ,  -   ,"100,00%"
ULM/Plane,1461215,Balade d’1h en avion privé pour 3 à Besançon et ses alentours,Balade (durée),privé,Bourgogne-Franche-Comté,Besançon,,60,3,"234,90"," €  548,10 ",  78 ,  2 , €  -   ,  -   ,  -   ,"100,00%"
ULM/Plane,1483705,20 min d'initiation au pilotage à bord d'un avion électrique près de Brest,Initiation,,Bretagne,Brest,,20,,"99,90"," €  1 282,05 ",  280 ,  13 , €  -   ,  -   ,  -   ,"100,00%"
ULM/Plane,1467720,45 min de vol en avion au-dessus de la Côte d'Opale au départ du Touquet,(Durée) de vol,,Hauts-de-France,Côte d'Opale,,45,,"179,90"," €  419,77 ",  119 ,  2 , €  -   ,  -   ,  -   ,"100,00%"
ULM/Plane,1506510,Biscarosse vue d’en haut : baptême de l’air de 25 min avec pilotage en Stampe SV4 RS,"(lieu) vue d'en haut, Baptême de l’air",,Nouvelle-Aquitaine,Biscarosse,,25,,"199,90"," €  233,22 ",  8 ,  1 , €  -   ,  -   ,  -   ,"100,00%"
ULM/Plane,1414139,2h30 de vol en avion et 1h d'escale en bord de mer pour 2,(Durée) de vol,escale,Offre box France Entière,France entière,,150,2,"679,90"," €  793,22 ",  361 ,  1 , €  -   ,  379 ,  -   ,"100,00%"
ULM/Plane,1467726,A flight by plane with a private pilot (1h30) | A briefing (10 min) | Un vol en avion avec un pilote privé (1h30) | Un briefing (10 min),Un vol en avion avec un pilote privé,privé,Offre box France Entière,France entière,,90,,"359,90"," €  419,88 ",  49 ,  1 , €  -   ,  -   ,  -   ,"100,00%"
ULM/Plane,1467723,A flight by plane with a private pilot (30 min) | A briefing (10 min) | Un vol en avion avec un pilote privé (30 min) | Un briefing (10 min),Un vol en avion avec un pilote privé,privé,Offre box France Entière,France entière,,30,,"179,90"," €  3 148,25 ",  217 ,  18 , €  -   ,  -   ,  -   ,"100,00%"
ULM/Plane,1467724,A flight by plane with a private pilot (45 min) | A briefing (10 min) | Un vol en avion avec un pilote privé (45 min) | Un briefing (10 min),Un vol en avion avec un pilote privé,privé,Offre box France Entière,France entière,,45,,"269,90"," €  629,77 ",  127 ,  2 , €  -   ,  -   ,  -   ,"100,00%"
ULM/Plane,1461180,Côte d'Azur vue du ciel : 1h de balade en avion privé pour 3 au départ de Cannes,(lieu) vue du ciel,privé,PACA,Côte d'Azur,,60,3,"258,90"," €  1 208,20 ",  269 ,  5 , €  -   ,  -   ,  -   ,"100,00%"
ULM/Plane,1467651,A private air ride from the Mediterranean coast (45min) | Un tour en avion privé depuis la côte méditerranéenne (45min),Un tour ,privé,PACA,côte méditerranéenne,,45,,"219,90"," €  256,55 ",  70 ,  1 , €  -   ,  -   ,  -   ,"100,00%"
ULM/Plane,1461216,Le Mans et ses alentours vus du ciel : survol d'1h pour 2 personnes,(lieu) vus du ciel,,Pays-De-La-Loire,Mans,,60,2,"174,90"," €  204,05 ",  82 ,  1 , €  -   ,  -   ,  -   ,"100,00%"
ULM/Plane,1382011,Survol de 45 minutes en avion du Grand Site de France des Deux-Caps pour 2,Survol de (Durée),,Hauts-de-France,Grand Site de France des Deux-Caps,,45,2,"269,90"," €  944,65 ",  82 ,  4 ," €  449,83 ",  606 ,  2 ,"110,00%"
ULM/Plane,1382009,Private Flight for 2 | Vol privé pour 2,Vol privé,privé,Offre box France Entière,France entière,,,2,"119,90"," €  4 056,62 ",  1 188 ,  34 ," €  1 798,50 ",  807 ,  15 ,"125,56%"
ULM/Plane,558031,Profitez d’un baptême de l’air en avion au-dessus de la Côte d’Opale depuis Le Touquet,Profitez d’un baptême de l’air,,Hauts-de-France,Côte d’Opale,,,,"59,00"," €  6 952,17 ",  3 123 ,  118 ," €  2 556,67 ",  1 516 ,  43 ,"171,92%"
ULM/Plane,558029,Baptême de l’air en avion au-dessus du littoral de la Côte d’Opale pendant 20 minutes,Baptême de l’air,,Hauts-de-France,Côte d’Opale,,20,,"49,50"," €  5 024,25 ",  1 694 ,  102 ," €  1 815,00 ",  875 ,  37 ,"176,82%"
ULM/Plane,1397526,Initiation au pilotage d'avion lors d'1 vol découverte près de Lille,Initiation,,Hauts-de-France,Lille,,,,"99,90"," €  6 993,00 ",  1 793 ,  70 ," €  2 331,00 ",  908 ,  23 ,"200,00%"
ULM/Plane,590538,Leçon de pilotage aux commandes d'un avion de tourisme aux Milles dans les Bouches-du-Rhône,Leçon de pilotage,,PACA,Bouches-du-Rhône,,,,"142,00"," €  2 485,00 ",  618 ,  18 ," €  828,33 ",  540 ,  6 ,"200,00%"
ULM/Plane,1456446,Survol privé d'1h30 du mont Saint-Michel et de la Normandie pour 2,Survol privé,privé,Normandie,Mont Saint-Michel,,90,2,"264,90"," €  11 434,85 ",  944 ,  43 ," €  3 752,75 ",  664 ,  14 ,"204,71%"
ULM/Plane,1131370,Pilotage dans les airs,Pilotage dans les airs,,Offre box France Entière,France entière,,,,"189,90"," €  17 724,00 ",  3 499 ,  93 ," €  5 380,50 ",  1 870 ,  28 ,"229,41%"
Fighter aircraft,1443478,Vol de 20 minutes à bord d'un avion de chasse L-29 Delfin en Slovaquie,Vol de (durée),,Offre en dehors France,Slovaquie,,20,,"1 932,10", €  -   ,  194 ,  -   ," €  1 610,08 ",  400 ,  1 ,"-100,00%"
Fighter aircraft,1409987,Vlucht in een L-39 Albatros straaljager boven de Zwitserse Alpen | Vol en avion de chasse L-39 Albatros au-dessus des Alpes suisses,Vol en avion de chasse,PASSER LES TEXTES FRANCAIS,Offre en dehors France,Suisse,,,CHANGER PRIX,"3 816,90", €  -   ,  198 ,  -   ," €  3 180,75 ",  196 ,  1 ,"-100,00%"
Fighter aircraft,1443476,Pilote d'un jour en Allemagne : formation et vol en avion de chasse L-39 Albatros,Pilote d'un jour,,Offre en dehors France,Allemagne,,,,"2 921,90", €  -   ,  175 ,  -   , €  -   ,  336 ,  -   ,"0,00%"
Fighter aircraft,1409996,Pilote d'un jour en Californie : vol de 40 minutes en jet militaire L-39 Albatros,Pilote d'un jour,,Offre en dehors France,Californie,,40,,"3 373,90", €  -   ,  80 ,  -   , €  -   ,  81 ,  -   ,"0,00%"
Fighter aircraft,1409991,Vol sensationnel dans un L-39 Albatros en Californie,Vol sensationnel,,Offre en dehors France,Californie,,,,"3 795,90", €  -   ,  109 ,  -   , €  -   ,  76 ,  -   ,"0,00%"
Fighter aircraft,1409998,Pilote d'un jour en Floride : vol de 30 minutes sur un jet militaire L-39 Albatros,Pilote d'un jour,,Offre en dehors France,Floride,,30,,"2 868,90", €  -   ,  374 ,  -   , €  -   ,  469 ,  -   ,"0,00%"
Fighter aircraft,1409993,Vol spectaculaire de 45 minutes en L-39 Albatros en Floride,Vol spectaculaire,,Offre en dehors France,Floride,,45,,"3 373,90", €  -   ,  101 ,  -   , €  -   ,  108 ,  -   ,"0,00%"
Fighter aircraft,1409992,Vol spectaculaire de 60 minutes dans un Albatros L-39 en Floride,Vol spectaculaire,,Offre en dehors France,Floride,,60,,"3 795,90", €  -   ,  138 ,  -   , €  -   ,  103 ,  -   ,"0,00%"
Fighter aircraft,1409986,Vol spectaculaire dans un avion de chasse Jet Provost en Italie,Vol spectaculaire,,Offre en dehors France,Italie,,,,"2 509,90", €  -   ,  82 ,  -   , €  -   ,  143 ,  -   ,"0,00%"
Fighter aircraft,1410001,Pilote d'un jour à Riga : vol de 25 min dans un avion de chasse militaire L-39 Albatros,Pilote d'un jour,,Offre en dehors France,Lituanie - Riga,,25,,"2 007,90", €  -   ,  1 409 ,  -   , €  -   ,  1 047 ,  -   ,"0,00%"
Fighter aircraft,1409999,Pilote d'un jour à Riga : vol de 35 min dans un avion de chasse militaire L-39 Albatros,Pilote d'un jour,,Offre en dehors France,Lituanie - Riga,,35,,"2 861,90", €  -   ,  202 ,  -   , €  -   ,  296 ,  -   ,"0,00%"
Fighter aircraft,1410000,20-minütiger Flug mit einem L-39 Albatros-Kampfjet in Tschechien | Vol de 20 minutes dans un avion de chasse L-39 Albatros en République tchèque,Vol de (durée),PASSER LES TEXTES FRANCAIS,Offre en dehors France,République tchèque,,20,,"2 007,90", €  -   ,  130 ,  -   , €  -   ,  383 ,  -   ,"0,00%"
Fighter aircraft,1409994,Onvergetelijke vlucht in een L-39 Albatros in Tsjechië | Vol inoubliable en L-39 Albatros en République Tchèque,Vol inoubliable ,PASSER LES TEXTES FRANCAIS,Offre en dehors France,République Tchèque,,,,"2 961,90", €  -   ,  125 ,  -   , €  -   ,  167 ,  -   ,"0,00%"
Fighter aircraft,1409997,Pilote d’1 jour en République tchèque : vol de 20 minutes en avion de chasse MIG-15,Pilote d'un jour,OPTIMISATION CONTENUE,Offre en dehors France,République tchèque,,20,,"3 010,90", €  -   ,  127 ,  -   , €  -   ,  159 ,  -   ,"0,00%"
Fighter aircraft,1409995,Droomvlucht in een L-29 Delfín in Slowakije | Vol de rêve en L-29 Delfin en Slovaquie,Vol de rêve,,Offre en dehors France,Slovaquie,,,,"2 007,90", €  -   ,  79 ,  -   , €  -   ,  156 ,  -   ,"0,00%"
Fighter aircraft,1409985,Exclusieve vlucht boven de Zwitserse Alpen in een Hawker Hunter | Vol exclusif au-dessus des Alpes suisses dans un Hawker Hunter,Vol exclusif ,,Offre en dehors France,Suisse - Alpes suisses,,,,"7 531,90", €  -   ,  646 ,  -   , €  -   ,  433 ,  -   ,"0,00%"
Fighter aircraft,1443477,Vol sensationnel de 30 minutes à bord d’un avion de chasse L-39 Albatros en France,Vol sensationnel,,Offre box France Entière,France entière,,30,,"2 575,20"," €  6 008,80 ",  3 835 ,  2 ," €  4 292,00 ",  801 ,  2 ,"40,00%"
Fighter aircraft,1409989,Avontuurlijke vlucht in een MB-326 gevechtsvliegtuig in Italië | Vol d'aventure dans un avion de chasse MB-326 en Italie,Vol d'aventure,,Offre en dehors France,Italie,,,,"2 509,90"," €  2 928,22 ",  168 ,  1 , €  -   ,  86 ,  -   ,"100,00%"
Helicopter,1467667,Découverte de Chalon-sur-Saîne et ses environs durant 10 min en hélicoptère,Découverte (lieu),,Bourgogne-Franche-Comté,Chalon-sur-Saône,,10,,"79,90"," €  93,22 ",  61 ,  1 , €  -   ,  -   ,  -   ,"100,00%"
Helicopter,1342130,20 minutes de survol du Mont-Blanc en hélicoptère depuis les Arcs 1950,(Durée) de survol,depuis les Arcs 1950,Auvergne-Rhône-Alpes,Mont-Blanc,,20,,"179,90", €  -   ,  350 ,  -   ," €  1 349,25 ",  798 ,  8 ,"-100,00%"
Helicopter,1398305,30 minutes de survol magique de Lyon en hélicoptère,(Durée) de survol,,Auvergne-Rhône-Alpes,Lyon,,30,,"199,90", €  -   ,  -   ,  -   ," €  666,33 ",  211 ,  3 ,"-100,00%"
Helicopter,1396439,Lyon vue du ciel : survol en hélicoptère autour de la ville pour 2,(lieu) vue du ciel,,Auvergne-Rhône-Alpes,Lyon,,,2,"399,90", €  -   ,  -   ,  -   ," €  666,50 ",  73 ,  2 ,"-100,00%"
Helicopter,1413492,Survol en hélicoptère de 25 min du Vercors ou de Crozes-Hermitage,Survol en,,Auvergne-Rhône-Alpes,Vercors ou de Crozes-Hermitage,,25,,"249,90", €  -   ,  100 ,  -   ," €  208,25 ",  152 ,  1 ,"-100,00%"
Helicopter,1382592,Baptême mémorable de 30 minutes en hélicoptère près de Dijon,Baptême mémorable,,Bourgogne-Franche-Comté,Dijon,,30,,"209,90", €  -   ,  79 ,  -   ," €  174,92 ",  120 ,  1 ,"-100,00%"
Helicopter,1412484,Baptême de l’air en hélicoptère en Touraine,Baptême de l’air,,Centre-Val-De-Loire,Touraine,,,,"84,90", €  -   ,  -   ,  -   ," €  990,50 ",  1 518 ,  12 ,"-100,00%"
Helicopter,1412522,Château de Chambord vu du ciel : 1h de vol magique en hélicoptère pour 2,(lieu) vu du ciel,,Centre-Val-De-Loire,Château de Chambord,,60,2,"739,90", €  -   ,  -   ,  -   ," €  616,58 ",  466 ,  1 ,"-100,00%"
Helicopter,1342603,"Découverte de 20 min en hélicoptère des châteaux de la Loire et leurs jardins, pour 2 personnes",Découverte (lieu),,Centre-Val-De-Loire,Château de la loire,,20,2,"337,90", €  -   ,  50 ,  -   ," €  563,17 ",  114 ,  2 ,"-100,00%"
Helicopter,1342600,Vol 25 min en hélicoptère à la découverte d'Amboise et des châteaux de la Loire,Vol (durée),,Centre-Val-De-Loire,Amboise et des châteaux de la Loire,,25,,"179,90", €  -   ,  305 ,  -   ," €  149,92 ",  609 ,  1 ,"-100,00%"
Helicopter,1412517,Vol en hélicoptère inoubliable de 40 min pour 2 au-dessus du château de Chenonceau,Vol en,,Centre-Val-De-Loire,château de Chenonceau,,40,2,"437,90", €  -   ,  -   ,  -   ," €  729,83 ",  405 ,  2 ,"-100,00%"
Helicopter,1412488,Vol fabuleux de 40 min en hélicoptère au-dessus du château de Chenonceau,Vol fabuleux,,Centre-Val-De-Loire,château de Chenonceau,,40,,"219,90", €  -   ,  -   ,  -   ," €  183,25 ",  203 ,  1 ,"-100,00%"
Helicopter,1411929,Vol panoramique en hélicoptère au-dessus du château de Villandry pour 2,Vol panoramique en ,,Centre-Val-De-Loire,château de Villandry,,,2,"239,90", €  -   ,  -   ,  -   ," €  1 199,50 ",  298 ,  5 ,"-100,00%"
Helicopter,1462155,Survol en hélicoptère du fort Boyard et du phare de Chassiron durant 30 minutes,Survol en,,Nouvelle-Aquitaine,fort Boyard / phare de Chassiron,,30,,"219,90", €  -   ,  123 ,  -   ," €  183,25 ",  71 ,  1 ,"-100,00%"
Helicopter,1462151,"Survol spectaculaire en hélicoptère : fort Boyard, phare de Chassiron et La Cotinière",Survol  spectaculaire,,Nouvelle-Aquitaine,Fort Boyard / phare de Chassiron et La Cotinière,,,,"219,90", €  -   ,  34 ,  -   ," €  366,50 ",  130 ,  2 ,"-100,00%"
Helicopter,1474237,Vol en hélicoptère au-dessus du fort Boyard,Vol en,,Nouvelle-Aquitaine,Fort Boyard,,,,"89,90", €  -   ,  177 ,  -   ," €  224,75 ",  491 ,  3 ,"-100,00%"
Helicopter,1366444,Vol en hélicoptère et dîner accords mets et vins pour 2,Vol en ,"vin, accords mets",Offre box France Entière,France entière,,,2,"799,80", €  -   ,  -   ,  -   ," €  666,50 ",  42 ,  1 ,"-100,00%"
Helicopter,1411931,Baptême de l'air en hélicoptère dans le Centre-Val de Loire,Baptême de l'air en,,Centre-Val-De-Loire,Centre-Val de Loire,,,,"39,90"," €  46,55 ",  393 ,  1 ," €  465,50 ",  1 140 ,  12 ,"-90,00%"
Helicopter,1354011,Survol découverte du fort Boyard en hélicoptère pour 2 depuis l'île d'Oléron,Survol découverte,depuis l'île d'Oléron,Nouvelle-Aquitaine,Fort Boyard / Fort Boyard,,,2,"159,90"," €  373,10 ",  89 ,  2 ," €  1 865,50 ",  837 ,  12 ,"-80,00%"
Helicopter,1462149,Découverte du fort Boyard en hélicoptère pour 1 amateur de vol,Découverte (lieu),,Nouvelle-Aquitaine,Fort Boyard,,,1,"89,90"," €  419,53 ",  140 ,  5 ," €  2 022,75 ",  891 ,  23 ,"-79,26%"
Helicopter,1474226,Survol magique du bassin d'Arcachon en hélicoptère à vivre en duo,Survol magique,,Nouvelle-Aquitaine,Arcachon,,,2,"159,90"," €  1 119,30 ",  543 ,  7 ," €  3 331,25 ",  1 200 ,  21 ,"-66,40%"
Helicopter,1474238,Survol du mont Blanc en hélicoptère pendant 30 minutes depuis Megève,Survol (lieu),Depuis Megève,Auvergne-Rhône-Alpes,Mont-Blanc,,30,1,"219,90"," €  8 466,15 ",  1 111 ,  39 ," €  22 356,50 ",  2 454 ,  102 ,"-62,13%"
Helicopter,1474219,30 minutes de survol du mont Blanc en hélicoptère pour 2,(Durée) de survol,,Auvergne-Rhône-Alpes,Mont-Blanc,,30,2,"399,90"," €  9 331,00 ",  537 ,  23 ," €  21 994,50 ",  1 071 ,  55 ,"-57,58%"
Helicopter,1456442,Balade aérienne privée pour découvrir à 2 les châteaux de la région parisienne,Balade aérienne,privé,Paris & Île-de-France,Châteaux région parisienne,,,2,"184,90"," €  431,43 ",  153 ,  2 ," €  924,50 ",  177 ,  5 ,"-53,33%"
Helicopter,1366280,Vol en hélicoptère et massage avec détente au spa pour un duo,Vol en ,Massage,Offre box France Entière,France entière,,,2,"799,80"," €  933,10 ",  255 ,  1 ," €  1 999,50 ",  345 ,  3 ,"-53,33%"
Helicopter,1474225,Survol en hélicoptère autour du bassin d’Arcachon pour 2,Survol en,,Nouvelle-Aquitaine,bassin d’Arcachon,,,2,"399,90"," €  1 866,20 ",  128 ,  5 ," €  3 665,75 ",  266 ,  9 ,"-49,09%"
Helicopter,1474227,Survol magique en hélicoptère du bassin d’Arcachon,Survol magique,,Nouvelle-Aquitaine,bassin d’Arcachon,,,,"264,90"," €  3 090,50 ",  341 ,  12 ," €  5 518,75 ",  891 ,  21 ,"-44,00%"
Helicopter,1405035,Vol en hélicoptère de 30 min au-dessus du fort Boyard et de l'île d'Oléron,Vol en ,,Nouvelle-Aquitaine,fort Boyard / l'île d'Oléron,,30,,"399,90"," €  466,55 ",  29 ,  1 ," €  666,50 ",  341 ,  2 ,"-30,00%"
Helicopter,1474224,Survol exceptionnel du mont Blanc en hélicoptère pour 2,Survol exceptionnel,,Auvergne-Rhône-Alpes,Mont-Blanc,,30,2,"399,90"," €  3 265,85 ",  637 ,  8 ," €  3 999,00 ",  1 044 ,  10 ,"-18,33%"
Helicopter,1474228,Initiation au pilotage d'un hélicoptère autour de Grenoble,Initiation,,Auvergne-Rhône-Alpes,Grenoble,,,,"279,90"," €  979,65 ",  168 ,  4 ," €  1 166,25 ",  230 ,  4 ,"-16,00%"
Helicopter,1456445,Balade aérienne privée des plages du débarquement,Balade aérienne,privé,Normandie,plages du débarquement,,,,"149,90"," €  3 672,55 ",  645 ,  25 ," €  4 247,17 ",  703 ,  28 ,"-13,53%"
Helicopter,1474240,Vol magique en hélicoptère autour du château de Versailles et des Yvelines,Vol magique ,,Paris & Île-de-France,château de Versailles/Yvelines,,,,"219,90"," €  1 282,75 ",  312 ,  6 ," €  1 466,00 ",  749 ,  7 ,"-12,50%"
Helicopter,1474234,Survol découverte en hélicoptère du bassin d'Arcachon,Survol découverte,,Nouvelle-Aquitaine,Arcachon,,,,"89,90"," €  943,95 ",  1 156 ,  11 ," €  1 048,83 ",  1 129 ,  12 ,"-10,00%"
Helicopter,1342606,Vol de 25 min en hélicoptère pour découvrir à 2 Amboise et les châteaux de la Loire,Vol découverte hélicoptère ,,Centre-Val-De-Loire,Amboise et les châteaux de la Loire,,25,2,"357,90"," €  835,10 ",  117 ,  2 ," €  894,75 ",  154 ,  3 ,"-6,67%"
Helicopter,1366216,Vol en hélicoptère et atelier œnologie en duo,Vol en ,vin,Offre box France Entière,France entière,,,2,"699,80"," €  1 632,87 ",  150 ,  2 ," €  1 749,50 ",  167 ,  3 ,"-6,67%"
Helicopter,1462150,Vol découverte en hélicoptère vers le fort Boyard et le phare de Chassiron,Vol découverte,,Nouvelle-Aquitaine,fort Boyard /phare de Chassiron,,,,"144,90"," €  338,10 ",  44 ,  2 ," €  362,25 ",  343 ,  3 ,"-6,67%"
Helicopter,1474214,20 minutes de survol du mont Blanc en hélicoptère à 2,(Durée) de survol,,Auvergne-Rhône-Alpes,Mont-Blanc,,20,2,"299,90"," €  12 245,92 ",  1 216 ,  41 ," €  12 995,67 ",  1 200 ,  43 ,"-5,77%"
Helicopter,1508908,Balade en hélicoptère de 20 minutes à 2 au-dessus de l'ouest lyonnais,Balade en ,,Auvergne-Rhône-Alpes,Ouest lyonnais,,20,2,"359,90", €  -   ,  27 ,  -   , €  -   ,  -   ,  -   ,"0,00%"
Helicopter,1508915,Promenade dans les airs : 20 min de vol en hélicoptère pour 2 au départ de Saint-Étienne,Promenade dans les airs,,Auvergne-Rhône-Alpes,Saint-Étienne,,20,2,"359,90", €  -   ,  30 ,  -   , €  -   ,  -   ,  -   ,"0,00%"
Helicopter,1508907,Survol de 20 min en hélicoptère de Lyon Est-Miribel pour 2,Survol (Durée),,Auvergne-Rhône-Alpes,Lyon Est-Miribel ,,20,2,"359,90", €  -   ,  53 ,  -   , €  -   ,  -   ,  -   ,"0,00%"
Helicopter,1508909,"Vol en hélicoptère de 20 min pour 2 au dessus de Roanne, la Loire et ses environs",Vol en ,,Auvergne-Rhône-Alpes,Roanne,,20,2,"359,90", €  -   ,  34 ,  -   , €  -   ,  -   ,  -   ,"0,00%"
Helicopter,1344594,Vol sur mesure en hélicoptère d'1h en Savoie,Vol sur-mesure,,Auvergne-Rhône-Alpes,Savoie,,60,,"649,90", €  -   ,  87 ,  -   , €  -   ,  81 ,  -   ,"0,00%"
Helicopter,1483667,Promenade dans les airs : 20 min de vol en hélicoptère au départ de Mâcon,Promenade dans les airs,,Bourgogne-Franche-Comté,Mâcon,,20,1,"184,90", €  -   ,  34 ,  -   , €  -   ,  -   ,  -   ,"0,00%"
Helicopter,1508905,Promenade dans les airs : 20 min de vol en hélicoptère pour 2 au départ de Mâcon,Promenade dans les airs,,Bourgogne-Franche-Comté,Mâcon,,20,2,"359,90", €  -   ,  23 ,  -   , €  -   ,  -   ,  -   ,"0,00%"
Helicopter,1462146,Vol d'initiation au pilotage d'hélicoptère à Chalon-sur-Saône,Vol d'initiation,,Bourgogne-Franche-Comté,Chalon-sur-Saône,,,,"295,90", €  -   ,  120 ,  -   , €  -   ,  153 ,  -   ,"0,00%"
